track_name,lyrics
Under Control,"I don't wanna waste your time I don't wanna waste your time I just wanna say I've got to say We worked hard, darling We don't have no control We're under control I don't wanna do it your way I don't wanna do it your way I don't wanna give it to you, your way I don't want to know... I don't wanna change your mind I don't wanna change the world I just wanna watch it go by– I just wanna watch you go by We were young, darling We don’t have no control We’re out of control I don't wanna do it your way I don't wanna do it your way I don't wanna give it to you, your way I don't want to know... I don't wanna change your mind I don't wanna waste your time I just wanna know you're alright I've got to know you're alright You are young, darling For now, but not for long Under control"
The Way It Is,"She was still sleeping, the problem will stay One more day Said she's not sorry the wind blows her way Accidents happen, there's one planned today Oh you see I wish it was not true, but that's the way it is It's not your fault, that's the way it is I'm sick of you, and that's the way it is And will always be Wednesday is over, it's over again Said my goodbyes to the life we won't spend Together I wish it was not true, but that's the way it is It's not your fault, that's the way it is I'm sick of you, and that's the way it is But that's not your problem That's not a problem That's not my problem That's not your problem"
The End Has No End,"One by one, ticking time bombs won It's not the secrets of the government that's keeping you dumb Oh, it's the other way around — wait, what's that sound? One by one, baby, here they come He wants it easy, he want it relaxed Said I can do a lot of things, but I can't do that Two steps forward then three steps back, alright ""Won't you take a walk outside?"" Oh no ""Can't you find some other guy?"" Oh no ""One-nine-six-nine, what's that sound?"" Oh no Keeping down the underground, oh no The end has no end, the end has no end The end has no end, the end has no end He want it easy, he want it relaxed Said I can do a lot of things, but I can't do that Two steps forward then three steps back It won't be easy ""Won't you take a walk outside?"" Oh no ""Can't you find another guy?"" Oh no ""One-nine-six-three, what's that sound?"" Oh no Keeping down the underground, oh no The end has no end, the end has no end The end has no end, the end has no end The end has no end, the end has no end The end has no end, the end has no end"
I Can't Win,"That was you up on the mountain All alone and all surrounded Walking on the ground you're breaking Laughing at the life you're wasting One, two tries won't do it You do it all your life and you never get through it Everything they had to say Had been erased in just one day ""Good try, we don't like it"" ""Good try, we won't take that shit"" Oh, I can't win Things in bars that people do When no one wants to talk to you Failing can be quite a breeze He told me that these girls were easy Happy that you said you'd mount me Felt unlucky when you found me Some nights come up empty handed Yes, I'll take it Wait now, by the sidewalk Hold on, yes, I'll be right back Oh, I can't win Yeah, I wait for something ""Cool it, we won't take that shit"" ""Good try, we don't like it"" Hold on, yes, I'll be right back"
Is This It,"Can't you see I'm trying? I don't even like it I just lied to get to your apartment Now I'm staying there just for a while I can't think 'cause I'm just way too tired Is this it? Is this it? Is this it? Said they'd give you anything you ever wanted When they lied, I knew it was just stable Children trying hard not to realize I was sitting right behind you Dear, can't you see? It's them, it's not me We're not enemies, we just disagree If I was like him, all pissed in this bar He changes his mind, says I went too far We all disagree, I think we should disagree, yeah Is this it? Is this it? Is this it? Can't you see I'm trying? I don't even like it I just lied to get to your apartment Now I'm staying there just for a while I can't think 'cause I'm just way too tired"
The Modern Age,"Up on a hill, here's where we begin This little story, a long time ago Start to pretend, stop pretending It seems this game is simply never-ending Oh, in the sun, sun, having fun, it's in my blood I just can't help it Don't want you here right now, let me go Oh, let me g-g-g-g-g-g-g-go Leaving just in time, stay there for a while Rolling in the ocean, trying to catch her eye Work hard and say it's easy, do it just to please me Tomorrow will be different, so I'll pretend I'm leaving I feel so different now, we trained at A-V-A I wish you hadn't stayed, my vision's clearer now but I'm unafraid Flying overseas, no time to feel the breeze I took too many varieties Oh, in the sun, sun, having fun, it's in my blood I just can't help it Don't want you here right now, let me go, woo! Darling, let me g-g-g-g-g-g-g-go Leaving just in time, stay there for a while Rolling in the ocean, trying to catch her eye Work hard and say it's easy, do it just to please me Tomorrow will be different, so this is why I'm leaving"
Soma,"Soma is what they would take when Hard times opened their eyes Saw pain in a new way High stakes for a few names Racing against sunbeams Losing against fig trees In your eyes And I am Stop And go In your eyes See, I am Stop And go In your eyes Let's go When I saw her for the first time Lips moved as her eyes closed Heard something in his voice ""And I'll be there,"" he says Then he walks out Somehow he was trying Too hard to be like them And I am Stop And go In your eyes And I am Stop Oh, darling let me go Tried it once and they liked it And tried to hide it Says, ""I've been doing this twenty-five years"" Well, I'm not listening no more And these friends, they keep asking for more Oh, yeah, oh, but that's it"
Barely Legal,"I didn't take no shortcuts I spent the money that I saved up Oh, mama running out of luck But like my sister, don't give a fuck I wanna steal your innocence To me, my life, it don't make any sense These strange manners, I love 'em so Why won't you wear your new trenchcoat? I should have worked much harder I should have just not bothered I never show up on weekdays And something that you learned yesterday Drive you to work and you'll be on time These little problems, they're not yours, they're mine Come on, listen to what I say I've got some secrets that'll make you stay I just want to turn you down I just want to turn you around Oh, you ain't never had nothing I wanted, but I want it all, I just can't figure out Nothing And all together, it went well We made pretend, we were best friends Then she said, ""Oh, you're a freak"" They ordered me to make mistakes Together again, like the beginning It all works somehow in the end The things we did, the things you hide But for the record, it's between you and I Oh, I didn't take no shortcuts I spent the money that I saved up Oh, mama running out of luck And like my sister, don't give a fuck I wanna steal your innocence To me, my life, it just don't make any sense Oh, strange manners, I love 'em so Why won't you wear your new trenchcoat? I just want to misbehave I just want to be your slave Oh, you ain't never had nothing I wanted, but I want it all, I just can't figure out Nothing And all together, it went well We made pretend, we were best friends Then she said, ""Oh, I can wait"" They ordered me to make mistakes Together again, like the beginning It all works somehow in the end The things we did, the things you hide But for the record, it's between you and I"
Someday,"In many ways, they'll miss the good old days Someday, someday Yeah, it hurts to say, but I want you to stay Sometimes, sometimes When we was young, oh man, did we have fun Always, always Promises, they break before they're made Sometimes, sometimes Oh, Maya says I'm lacking in depth I will do my best You say you wanna stand by my side Darling, your head's not right I see alone we stand; together we fall apart Yeah, I think I'll be alright I'm working so I won't have to try so hard Tables, they turn sometimes Oh, someday No, I ain't wasting no more time (Trying, trying) And now my fears, they come to me in threes So I sometimes Say, ""Fate, my friend, you say the strangest things I find sometimes"" Oh, Maya says I'm lacking in depth Shit, I will try my best You say you wanna stay by my side Darling, your head's not right I see alone we stand; together we fall apart Yeah, I think I'll be alright I'm working so I won't have to try so hard Tables, they turn sometimes Oh, someday I ain't wasting no more time"
"Alone, Together","No choice now, it's too late Let him go, he gave up I gave up Lisa said, ""Take time for me"" Dropping him down to his knees Ah, chest down Take me away, see, I've got to explain Things, they have changed in such a permanent way Life seems unreal, can we go back to your place? Oh, ""you drink too much"" makes me drink just the same People tried, felt so right Giving themselves good advice Looking down sometimes felt nice He knows it's justified to kill to survive He then, in dollars, makes more dead than alive Let's suck more blood, let's run three hours a day The world is over but I don't care 'Cause I am with you, now I've got to explain Things, they have changed in such a permanent way Life seems unreal, can we go back to your place? Oh, ""You drink too much"" makes me drink just the same The first time, it happened too fast The second time, I thought it would last We all like it a little different"
Last Nite,"Last night, she said ""Oh, baby, I feel so down Oh, it turns me off When I feel left out"" So I, I turned 'round Oh, baby, don't care no more I know this for sure I'm walking out that door Well, I've been in town for just 'bout fifteen, oh, minutes now And baby, I feel so down And I don't know why I keep walking for miles And say, people, they don't understand No, girlfriends, they can't understand Your grandsons, they won't understand On top of this, I ain't ever gonna understand Last night, she said ""Oh, baby, don't feel so down Oh, it turns me off When I feel left out"" So I, I turned 'round Oh, baby, gonna be alright It was a great big lie 'Cause I left that night, yeah Oh, people, they don't understand No, girlfriends, they don't understand In spaceships, they won't understand And me, I ain't ever gonna understand Last night, she said ""Oh, baby, I feel so down See, it turns me off When I feel left out"" So I, I turned 'round Oh, little girl, I don't care no more I know this for sure I'm walking out that door, yeah"
Hard To Explain,"Was an honest man Asked me for the phone, tried to take control Oh, I don't see it that way I don't see it that way We shared some ideas All obsessed with fame, says we're all the same Oh, I don't see it that way I don't see it that way Raised in Carolina I'm not like that Trying to remind her When we go back I missed the last bus, I'll take the next train I'll try, but you see, it's hard to explain I say the right thing but act the wrong way I like it right here, but I cannot stay I'm watching TV, forget what I'm told Well, I am too young and they are too old The joke is on you, this place is a zoo You're right, it's true He said he can't decide I shake my head to say, ""everything's just great"" Oh, I just can't remember I just can't remember Raised in Carolina She says, ""I'm not like that"" Trying to remind her When we go back I say the right thing but act the wrong way I like it right here, but I cannot stay I'm watching TV, forget what I'm told Well, I am too young and they are too old Oh man, can't you see, I'm nervous, so please Pretend to be nice so I can be mean I missed the last bus, we'll take the next train I'll try, but you see, it's hard to explain"
When It Started,"Won't decide, but he won't debate Said, ""Thanks my friend, thought it was too late"" Oh, why, oh, why? I don’t know So you think things move pretty fast down here? Well, just wait, my dear, 'til you look up there Oh, maybe someday you’ll know Had his second kid, was an early night Got to be well-dressed, 'cause he hates to fly Oh, loves his job, takes it home Anything they wanted They could have it, have it Didn't even notice I don't mind it, mind it Won't decide, but he won't debate Said, ""Thanks my friend, thought that we was dead"" Oh why, oh, why? I don't know Think things move pretty fast down here? But just wait, my dear, 'til we get up there Oh, maybe someday, they'll know Come on, tell me does she warm the room When he comes? Or does he just know How to leave when it gets cold? Well, I don't care, I don't care 'Cause it's free"
Trying Your Luck,"You said you couldn't stay You've seen it all before, I know And sold you on their way Oh, honey, that's okay No harm, he's armed Setting off all your alarms When I find out I hope it's you who set this trap And store fronts rarely change At least I'm on my own again Instead of anywhere with you Oh, tell me it's all the same And I've lost my page again I know this is surreal, but I'll try my luck with you Oh, this life is on my side, oh, I am your one Believe me, this is a chance, oh, oh Let's see what is for sale He's trying not to give his job a chance Oh, it's never gonna be It's sad, but I agree The signals don't seem right It lasts for just one night and then I'm sorry that I said That we were just good friends No harm, he's armed Setting off all your alarms Entranced, I can't be here in time I'll think about that And I've lost my page again I know this is surreal, but I'll try my luck with you Oh, this life is on my side, oh, I am your one Believe me, oh, this is a chance, oh, oh"
Take It Or Leave It,"Leave me alone I'm in control, I'm in control And girls act too much and boys act too tough Enough is enough Well, on the minds of other men, I know she was I said just take it or leave it And take it or leave it, and take it or leave it And take it or leave it, oh, just take it or leave it And take it or leave it, oh, take it I say, oh, he's gonna let you down He's gonna let you down, he's gonna let you down And gonna break your back for a chance And gonna steal your friends, if he can He's gonna win someday I fell off the track, now I can't go back I'm not like that Boys act too much, girls act too tough Enough is enough Well, on the minds of other girls, I know he was I said just take it or leave it And take it or leave it, and take it or leave it And take it or leave it, oh, just take it or leave it And take it or leave it, oh, take it Oh, that's right, he's gonna let you down He's gonna let you down, he's gonna let you down And gonna break your back for a chance And gonna steal your friends, if he can He's gonna win someday, oh, he will"
